cinchona-officinalis|Reduces fever|"""Cinchona reduces fever"" refers to its ability to lower body temperature in febrile conditions, helping people feel better."
cinchona-officinalis|Soothes stomach upset|"""Cinchona soothes stomach upset"" refers to its ability to help alleviate discomfort or pain caused by indigestion, gastritis, and other digestive issues."
cinchona-officinalis|Boosts immune system|"""Cinchona boosts immune system"" refers to its ability to enhance the body's natural defenses against diseases."
cinchona-officinalis|Relieves headache|"""Cinchona relieves headache"" refers to its ability to alleviate or reduce pain associated with headaches using Cinchona, a plant-based medicine."
cinchona-officinalis|Lowers blood pressure|"""Cinchona lowers blood pressure"" refers to its ability to reduce hypertension or high blood pressure levels when used as a remedy."
cinchona-officinalis|Improves digestion|"""Cinchona improves digestion"" refers to its ability to enhance the process of breaking down food in the body, resulting in better absorption and easier elimination of waste materials."
cinchona-officinalis|Relieves pain and inflammation|"""Cinchona relieves pain and inflammation"" refers to its ability to alleviate suffering due to physical discomfort or swelling caused by certain conditions."
cinchona-officinalis|Increases energy levels|"""Cinchona increases energy levels"" refers to its effect of elevating a person's energy due to being rich in alkaloids, allowing individuals to feel more active and energized."
cinchona-officinalis|Promotes healthy sleep|"""Cinchona promotes healthy sleep"" refers to its ability to help individuals fall asleep quicker, have a deeper and more restful night's rest."
cinchona-officinalis|Enhances mental clarity|"""Cinchona enhances mental clarity"" refers to its ability to improve thinking capacity, focus, and memory performance."
